{
  "$schema": "./schema/compare.schema.json",
  "intro": "Interviewers love look-alike pairs because a memorized definition does not survive them. For each pair, say the tell first: one sentence that separates the two. Then say when you would pick each.",
  "status_options": [
    { "id": "new", "label": "New" },
    { "id": "shaky", "label": "Shaky" },
    { "id": "known", "label": "Known" }
  ],
  "groups": [
    { "id": "messaging", "name": "Messaging and streaming" },
    { "id": "network", "name": "Networking and edge" },
    { "id": "storage", "name": "Storage" },
    { "id": "database", "name": "Databases and analytics" },
    { "id": "compute", "name": "Compute and cost" },
    { "id": "security", "name": "Security and governance" },
    { "id": "ai", "name": "AI and ML" },
    { "id": "resilience", "name": "Resilience concepts" }
  ],
  "pairs": [
    { "id": "sqs-sns", "group": "messaging", "a": "SQS", "b": "SNS", "services": ["sqs", "sns"],
      "tell": "SQS is a queue one consumer group pulls from; SNS pushes each message to every subscriber.",
      "pick_a": "Buffer work so a worker fleet can process it at its own pace, with retries and a dead-letter queue.",
      "pick_b": "Fan one event out to many destinations at once: email, Lambda, or several SQS queues." },
    { "id": "sqs-kinesis", "group": "messaging", "a": "SQS", "b": "Kinesis Data Streams", "services": ["sqs", "kinesis-streams"],
      "tell": "SQS deletes a message once it is processed; Kinesis keeps an ordered, replayable log that many consumers read independently.",
      "pick_a": "Independent tasks where order does not matter (or FIFO per group) and each message is handled once.",
      "pick_b": "Clickstreams or telemetry where several consumers need the same ordered records and you may replay them." },
    { "id": "sns-eventbridge", "group": "messaging", "a": "SNS", "b": "EventBridge", "services": ["sns", "eventbridge"],
      "tell": "SNS is fast, simple fan-out by topic; EventBridge routes events by content rules and takes SaaS and AWS service events.",
      "pick_a": "High-throughput fan-out to many subscribers with simple filtering.",
      "pick_b": "Event-driven integration where rules match on event fields, schedules, or partner SaaS sources." },
    { "id": "kinesis-firehose", "group": "messaging", "a": "Kinesis Data Streams", "b": "Data Firehose", "services": ["kinesis-streams", "firehose"],
      "tell": "Streams is a log you write consumers for; Firehose is a managed pipe that delivers to S3, Redshift, or OpenSearch with no consumer code.",
      "pick_a": "Custom real-time processing, multiple consumers, or replay.",
      "pick_b": "Just land the data in a destination, with optional buffering and transformation." },
    { "id": "kinesis-msk", "group": "messaging", "a": "Kinesis Data Streams", "b": "MSK", "services": ["kinesis-streams", "msk"],
      "tell": "Kinesis is AWS-native and simple to run; MSK is managed Apache Kafka for teams that already speak Kafka.",
      "pick_a": "New streaming workloads that want the least operations work.",
      "pick_b": "Existing Kafka producers, consumers, and tooling you want to keep." },
    { "id": "stepfn-sqs", "group": "messaging", "a": "Step Functions", "b": "SQS", "services": ["step-functions", "sqs"],
      "tell": "Step Functions orchestrates a multi-step workflow with state; SQS only decouples one producer from one consumer stage.",
      "pick_a": "Ordered steps with branching, retries, timeouts, and a human approval wait.",
      "pick_b": "A single hand-off that absorbs bursts between two components." },
    { "id": "sg-nacl", "group": "network", "a": "Security group", "b": "Network ACL", "services": ["security-group", "nacl"],
      "tell": "A security group is stateful, allow-only, on the instance; a NACL is stateless, allow and deny, on the subnet.",
      "pick_a": "Default control for every resource: allow the app tier to reach the database port.",
      "pick_b": "A coarse subnet-wide deny, such as blocking a known bad address range. Remember return traffic rules." },
    { "id": "peering-tgw", "group": "network", "a": "VPC peering", "b": "Transit Gateway", "services": ["vpc-peering", "transit-gateway"],
      "tell": "Peering is a one-to-one link that is not transitive; Transit Gateway is a hub that connects many VPCs and on-premises networks.",
      "pick_a": "Two or three VPCs that need to talk, at the lowest cost.",
      "pick_b": "Dozens of VPCs plus VPN or Direct Connect, with central routing." },
    { "id": "igw-nat", "group": "network", "a": "Internet Gateway", "b": "NAT Gateway", "services": ["igw", "nat"],
      "tell": "An internet gateway allows traffic in and out for public subnets; a NAT gateway lets private subnets reach out while blocking inbound connections.",
      "pick_a": "Load balancers and bastion-free public endpoints in a public subnet.",
      "pick_b": "Private app servers that must download patches or call external APIs." },
    { "id": "gateway-interface-endpoint", "group": "network", "a": "Gateway endpoint", "b": "Interface endpoint", "services": ["privatelink"],
      "tell": "A gateway endpoint is a free route-table entry for S3 and DynamoDB only; an interface endpoint is a PrivateLink network interface for many services, billed per hour.",
      "pick_a": "Private access from a VPC to S3 or DynamoDB without NAT charges.",
      "pick_b": "Private access to other AWS services or to a partner service exposed through PrivateLink." },
    { "id": "dx-vpn", "group": "network", "a": "Direct Connect", "b": "Site-to-Site VPN", "services": ["direct-connect", "vpn"],
      "tell": "Direct Connect is a dedicated private line with steady latency but is not encrypted by default; VPN is an encrypted tunnel over the internet that you can set up in minutes.",
      "pick_a": "Large, steady hybrid traffic with predictable latency; add MACsec or a VPN over it for encryption.",
      "pick_b": "Fast, cheap, encrypted connectivity, or as a backup path for Direct Connect." },
    { "id": "alb-nlb", "group": "network", "a": "ALB", "b": "NLB", "services": ["alb", "nlb"],
      "tell": "ALB works at layer 7 and routes by path or host; NLB works at layer 4 with static IPs and very high throughput.",
      "pick_a": "HTTP and HTTPS apps, microservices behind one endpoint, path-based routing.",
      "pick_b": "TCP or UDP traffic, static IPs for allow-lists, or millions of connections per second." },
    { "id": "cloudfront-ga", "group": "network", "a": "CloudFront", "b": "Global Accelerator", "services": ["cloudfront", "global-accelerator"],
      "tell": "CloudFront caches HTTP content at the edge; Global Accelerator gives two static anycast IPs and routes TCP or UDP over the AWS backbone without caching.",
      "pick_a": "Websites, APIs, and media that benefit from caching near users.",
      "pick_b": "Non-HTTP traffic, gaming, or fast regional failover behind fixed IPs." },
    { "id": "r53-latency-geo", "group": "network", "a": "Latency routing", "b": "Geolocation routing", "services": ["route53"],
      "tell": "Latency routing sends users to the Region that answers fastest; geolocation routing sends users by where they are, regardless of speed.",
      "pick_a": "Global performance across several Regions.",
      "pick_b": "Data residency, language, or licensing rules tied to a country." },
    { "id": "region-az", "group": "resilience", "a": "Region", "b": "Availability Zone", "services": ["region", "az"],
      "tell": "A Region is a geographic area; an AZ is an isolated data center group inside it. Multi-AZ is for high availability, multi-Region is for disaster recovery.",
      "pick_a": "Choose by user latency, data residency, service availability, and price.",
      "pick_b": "Spread every production tier across at least two AZs." },
    { "id": "ebs-efs", "group": "storage", "a": "EBS", "b": "EFS", "services": ["ebs", "efs"],
      "tell": "EBS is a block disk in one AZ, usually attached to one instance; EFS is a shared NFS file system many instances mount across AZs.",
      "pick_a": "A database or boot volume that needs low-latency block storage.",
      "pick_b": "Shared files for a fleet of Linux instances or containers." },
    { "id": "efs-s3", "group": "storage", "a": "EFS", "b": "S3", "services": ["efs", "s3"],
      "tell": "EFS is a mounted file system with directories and file locks; S3 is object storage you reach over an API, with virtually unlimited scale.",
      "pick_a": "Applications that expect a POSIX file path.",
      "pick_b": "Data lakes, backups, static assets, and anything accessed by key over HTTP." },
    { "id": "s3ia-glacier-ir", "group": "storage", "a": "S3 Standard-IA", "b": "S3 Glacier Instant Retrieval", "services": ["s3-classes"],
      "tell": "Both return data in milliseconds; Standard-IA suits data read about monthly, Glacier Instant Retrieval suits data read about quarterly at lower storage cost and higher retrieval cost.",
      "pick_a": "Backups or older files you still open now and then.",
      "pick_b": "Archives like medical images that are rarely read but must open immediately." },
    { "id": "gateway-datasync", "group": "storage", "a": "Storage Gateway", "b": "DataSync", "services": ["storage-gateway", "datasync"],
      "tell": "Storage Gateway gives on-premises apps ongoing access to cloud storage; DataSync moves data from one place to another as a transfer job.",
      "pick_a": "Hybrid file shares or backups that keep running on premises.",
      "pick_b": "One-time or scheduled migration of large file sets into S3, EFS, or FSx." },
    { "id": "datasync-dms", "group": "storage", "a": "DataSync", "b": "DMS", "services": ["datasync", "dms"],
      "tell": "DataSync copies files and objects; DMS migrates and replicates databases, including ongoing change data capture.",
      "pick_a": "NFS or SMB shares and object stores.",